{"accepted_project_reference":{"content_hash":"sha256:153888eefbba5a1756ba4782096d23df6aaa60e3f538bda031f9086b98578124","project_id":"schuss-project-000031","revision":1},"canonical_profile":"schuss-canonical-json-v1","project_manifest_byte_sha256":"62dd5ba47ea1335f1a964b5af2b4750d6f1fa5aea35999a1f9517a7040a9102e","project_manifest_locator":"project/revisions/schuss-project-000031-r000001.json","schema_version":"workspace-head-v0"}
