{"accepted_project_reference":{"content_hash":"sha256:54d8d6c00a6dfeba60d1b2761f9d0b8120dea202d7d9af7107b9dc02b7548db9","project_id":"schuss-project-000032","revision":1},"canonical_profile":"schuss-canonical-json-v1","project_manifest_byte_sha256":"d6f4ab359b92b2f41d0d70a1790211cba2ca044e655e4c6634f9996412afbf9a","project_manifest_locator":"project/revisions/schuss-project-000032-r000001.json","schema_version":"workspace-head-v0"}
